{
  "schemaVersion": 1,
  "taskId": "20260728-001-talent-allocation",
  "parentTaskId": "20260728-001-talent-allocation",
  "idempotencyKey": "replace-enterprise-id|20260728-001-talent-allocation",
  "enterpriseId": "replace-enterprise-id",
  "primaryOrganization": "ai-organization-officer",
  "capabilityId": "talent-allocation",
  "status": "received",
  "accessEnvelope": {
    "enterpriseId": "replace-enterprise-id",
    "allowedScopes": [
      "organization.read",
      "organization.draft.write"
    ],
    "deniedScopes": [],
    "expiresAt": "2026-08-04T00:00:00.000Z"
  },
  "inputRefs": [],
  "knowledgeStatus": "pending",
  "candidateVersion": 0,
  "revision": 1,
  "failureCounts": {},
  "decisionRef": null,
  "approvedCandidateSha256": null,
  "createdAt": "2026-07-28T00:00:00.000Z",
  "updatedAt": "2026-07-28T00:00:00.000Z"
}
